{
	"sign_off": "Kind regards,",
	"salutation": "Dear Hiring Manager,",
	"body_paragraph_1": "At Map of Ag, leading product strategy for AI-powered agricultural solutions has meant framing problems worth solving and defining clear success criteria for a platform serving more than 8,000 farm connections. Using AWS Bedrock, rapid prototyping and testing delivered an AI-driven fertiliser intelligence tool that automates invoice ingestion, nutrient extraction and nitrogen analysis—demonstrating the AI-assisted delivery approach central to Propellerhead's methodology. This work reduced farm planning effort by 30% and scaled enterprise connectivity from 2,000 to 8,000 farms with zero service disruption, achieved through stakeholder alignment, backlog prioritisation and cross-functional coordination.",
	"body_paragraph_2": "A background in software services environments—including SaaS integrations for clients such as Z Energy, Caltex and Daiso at Triquestra International—has built strong foundations in client-facing delivery, scope management and maintaining long-term relationships through meaningful, continuous outcomes. At Vulcan Steel, discovery leadership for a hybrid multi-warehouse order management MVP delivered 8% revenue uplift by clearly defining the problem, hypotheses and success measures before execution. This experience reflects Propellerhead's commitment to working solely on funded backlog items and ensuring product teams remain informed of upcoming work and relevant context.",
	"closing_paragraph": "The opportunity to join an established software services company that values AI-native thinking and measurable delivery outcomes is compelling. Contributing product strategy expertise, discovery leadership and a track record of stakeholder collaboration to Propellerhead's client engagements would be a privilege. I welcome the opportunity to discuss how my experience aligns with your team's objectives and am available for an interview at your convenience.",
	"opening_paragraph": "With over nine years of experience delivering AI-powered product solutions across agritech, retail and enterprise environments, I am applying for the Product Strategist role at Propellerhead. Your emphasis on AI-native product strategy, value framing and continuous client delivery aligns directly with my career focus—translating complex business challenges into measurable product outcomes through discovery leadership and hypothesis-driven execution."
}